No,Username,Rating,Waktu,Ulasan_Bersih,Sentimen
435,kginap,5,2025-06-26 12:21,cocok bolu kualitas puas tepung mantap pas dieksekusiii,Positif
436,nienieng,5,2025-06-14 05:50,tekstur lembut guna bikin bolu ketan hitam sabar order tepung bummi hasil muas klo order jgn mepet order yg kali minggu,Positif
437,h*****k,5,2025-06-27 07:23,bagus tepung hitam pasir,Netral
438,tiajupe77,5,2025-06-16 21:55,tekstur lembut guna bolu sempet ngasih nilai bikin pake tepung ketan merk bummi order yg tepung wangi jg bolu cuman sayang aja pas order kirim kl po tulis aja kaa jd customer gak nunggu bolak lacak pesan over all bagus makasiihh kaa,Netral
439,uhanikk29,5,2025-06-13 19:18,coba tekstur bubuk guna bolu packing aman jg tau kalo lubang dikit biar engga kempes lap biar engga bocor sipp bgt sedih packing bgt moga improve yaa seller sukses yaa,Negatif
440,shanty_mkasari,5,2025-06-14 16:30,mantap tepung ketan pekat bagus kirim emang produksi dl sabar tp nyampe tapat makasih,Netral
441,dewin15,5,2025-06-16 07:02,tekstur kasar ketan guna kue viral kue yg sy jd bagus sisa tigl sdh pakai bungkus,Netral
442,l*****3,5,2025-06-15 10:17,sampean bikin produk kirim ckup warna hitam ckup pekat oke ngobatin pnasaran thankyou,Netral
443,iraherawati05,5,2025-06-13 17:00,ok tekstur tepung guna kue tepung ketan hitam cocok cake moga kue,Positif
444,d*****4,5,2025-06-12 11:14,warna cantik hitam pekat pokok beli recommended,Positif
445,nadiaalya2001,5,2025-06-12 15:32,kemas rapih barang aman sesuai pesan,Positif
446,y*****e,5,2025-07-01 15:38,lembut tekstur halus guna cocok kue udah habis bungkus tepung ketan lembut bikin kue viral gak bikin seret harga ramah kantong order udah habis,Positif
447,indah_ramlan,5,2025-07-03 17:29,alhamdulillah pesan barang blm coba mudah bagus terimakasih kak moga usaha lancar berkah,Positif
448,b*****e,5,2025-06-13 17:31,oke tekstur oke guna bolu ketan hitam alhamdulillah enaaak duh aja awet awet isi gr ku emang suka ketan hitam karna free gluten,Positif
449,ernisaman,5,2025-07-01 19:33,lezat tekstur bagus guna kue kualitas produk kirim cpt recommended makasih yaaa,Positif
450,o*****i,5,2024-03-25 16:56,kualitas foto brownies pake tepung bummi aroma ketan hitam mantep ngga kalah dark chocolatenya kemarin paksa bikin brownie pake tepung ketan hitam merek yg toko deket rumah hasil bagus pake tepung bummi bungkus pas resep ngga nimbang packagingnya lapis xd pake bubble wrap repeat order mah thank you nandamoethy,Positif
451,nandamoethy,5,2025-06-30 08:06,ketan hitam bagus banget warna hitam pekat manul makasii kak,Positif
452,nienieng,5,2025-06-26 15:56,kualitas bagus banget cocok bolu beli kali pokok recommended banget toko tepung ketan hitam,Positif
453,niazulhakimi,5,2025-06-29 17:46,sampenya alhamdulillah ga yg bocor aman thanx seller shope kurir,Negatif
454,a*****a,5,2025-06-16 22:57,tekstur lembut guna kue bolu keran brasa banget,Positif
455,susitriliyanti,5,2025-07-05 21:18,tekstur lembut tdk pasir guna bolu tdk bau apek tdk pasir langgan utk,Netral
456,ik_yuni_rahmawati,5,2025-06-12 10:12,khas pas tidaj manis tekstur halus khas beda dg brownies tepung guna cocok umtuk browmies kukus harga murah banding seller thanks,Positif
457,momentreseller,5,2025-07-05 09:21,ketan hitam tekstur lembut guna cocok kue bahan ketan hitam terimakasih ka admin paket tepung ketan cepat amanah dlm cepat proses order,Positif
458,u*****a,5,2025-06-30 13:19,tekstur lembut guna bikin kue tepung ny so far sesuai fresh cm kirim krn lg viral trs stok ny abis,Netral
459,t*****e,5,2025-07-01 19:21,tekstur lembut guna untum bolu ketan terimakasih seller next order toko,Positif
460,usitmaulida,5,2025-07-08 11:00,tekstur guna peking aman cepat,Positif
461,i*****b,5,2025-07-09 09:41,enakk tekstur lembut guna cocok bolu ketan tepung ketan beda yg ketan lembut wangi,Positif
462,dedecholis,5,2025-07-02 12:54,lezat tekstur textur yg bagus guna cocok bikin kue blom coba moga hasil bagus kirim cepat trimakasih shopee nex order,Positif
463,novitareviews,5,2025-07-03 20:55,ikut fomo bikin bolu coba mudah hasil sesuai ekspektasi,Positif
464,p*****z,5,2025-06-25 06:57,legit mantap tekstur ga grainy guna bikin bolu ketan ah banget pokok mantul,Positif
465,d*****h,5,2025-06-28 19:47,blm coba tekstur lembut guna bolu alhamdulillah recommended seller trimakasih,Positif
466,fitrisuciawati132,5,2025-07-08 11:05,tekstur lembut pasir guna cocok bolu,Netral
467,7shjesmdg8,5,2025-06-27 05:49,pas lidah manis tekstur lembut kenyal guna cocok kue lezat,Positif
468,d*****0,5,2023-11-14 14:56,cocok cake alhamdulillaah beli toko amanah service cepat packing rapi aman gak bocor terimakasih seller abang kurir moga sehat,Netral
469,stellafelicia420,5,2025-06-16 18:45,muas tekstur milik tekstur bagus guna cocok kue bolu lezat,Positif
470,rosesriani,5,2025-12-18 16:18,alhamdulillah sesuai pesan,Positif
471,e*****i,5,2025-09-17 18:36,tekstur kasar guna bikin kue,Netral
472,annatasya_snack,5,2025-09-18 18:12,murah sih warna tepung abu,Positif
473,k*****g,5,2025-11-25 07:35,udah dateng sih tp coba,Positif
474,asma_laela,5,2025-08-31 21:11,sesuai deakripsi,Positif
475,pocopoco186,5,2025-12-01 18:50,guna ok,Positif
476,arniorchid,5,2025-08-18 11:40,kyk beras tekstur halus guna kueh,Positif
477,y*****d,5,2025-07-11 19:10,makasih murah toko,Positif
478,nurulufah,5,2025-07-05 12:36,pesan moga hasil bagus,Positif
479,cinta_najla_muthya,5,2025-07-05 13:34,bolu,Positif
480,t*****7,5,2025-07-03 22:12,coba,Positif
481,mutiaraayudia.s04,5,2025-07-02 17:33,coba,Positif
482,khusnulmawwan,5,2025-06-29 17:40,coba sesuai order,Positif
483,linaemran20014,5,2025-06-28 14:22,coba,Positif
484,hijrotunnadia,5,2025-06-15 16:23,eksekusi,Positif
